{
  "id": "hbm",
  "tier": "T4",
  "name": "High-bandwidth memory (HBM3E / HBM4)",
  "summary": "",
  "what_it_does": "",
  "makers": [
    {
      "company": "SK Hynix",
      "country": "KR",
      "hq_city": null,
      "fab_locations": [],
      "market_share": {
        "value": null,
        "unit": "share",
        "source": null,
        "confidence": null,
        "verified": null
      }
    },
    {
      "company": "Samsung",
      "country": "KR",
      "hq_city": null,
      "fab_locations": [],
      "market_share": {
        "value": null,
        "unit": "share",
        "source": null,
        "confidence": null,
        "verified": null
      }
    },
    {
      "company": "Micron",
      "country": "US",
      "hq_city": null,
      "fab_locations": [],
      "market_share": {
        "value": null,
        "unit": "share",
        "source": null,
        "confidence": null,
        "verified": null
      }
    }
  ],
  "concentration": {
    "label": null,
    "hhi": {
      "value": null,
      "unit": "index",
      "source": null,
      "confidence": null,
      "verified": null
    },
    "note": ""
  },
  "cost": {
    "unit": "per GB",
    "price_band": {
      "low": null,
      "high": null,
      "currency": "USD",
      "source": null,
      "confidence": null,
      "verified": null
    },
    "note": ""
  },
  "lead_time": {
    "value": null,
    "unit": "weeks",
    "source": null,
    "confidence": null,
    "verified": null
  },
  "inputs": [
    "euv-lithography",
    "duv-lithography",
    "deposition-etch"
  ],
  "customers": [
    "cowos-packaging",
    "alt-packaging"
  ],
  "chokepoint_notes": "",
  "sources": [],
  "meta": {
    "status": "draft",
    "drafted_by": null,
    "verified_by": null,
    "approved_by": null,
    "approved_on": null,
    "last_refreshed": null
  }
}
