{
  "id": "leading-edge-fab",
  "tier": "T2",
  "name": "Leading-edge logic fabrication (3nm/2nm class)",
  "summary": "The factories that make the most advanced chips. Nearly all leading-edge AI chips come from TSMC.",
  "what_it_does": "A foundry takes a chip design and manufactures it on silicon wafers, using hundreds of process steps and machines like EUV scanners. The leading edge (3nm and 2nm class) is where the fastest, most power-efficient chips are made.\n\nAI chip designers such as Nvidia, AMD, Google and Amazon don't own factories. They send their designs to a foundry, and at the leading edge that foundry is almost always TSMC, most of whose capacity is in Taiwan.",
  "makers": [
    {
      "company": "TSMC",
      "country": "TW",
      "hq_city": null,
      "fab_locations": [],
      "market_share": {
        "value": null,
        "unit": "share",
        "source": null,
        "confidence": null,
        "verified": null
      }
    }
  ],
  "concentration": {
    "label": null,
    "hhi": {
      "value": null,
      "unit": "index",
      "source": null,
      "confidence": null,
      "verified": null
    },
    "note": ""
  },
  "cost": {
    "unit": "per wafer",
    "price_band": {
      "low": null,
      "high": null,
      "currency": "USD",
      "source": null,
      "confidence": null,
      "verified": null
    },
    "note": ""
  },
  "lead_time": {
    "value": null,
    "unit": "weeks",
    "source": null,
    "confidence": null,
    "verified": null
  },
  "inputs": [
    "euv-lithography",
    "duv-lithography",
    "deposition-etch"
  ],
  "customers": [
    "nvidia-gpu",
    "amd-instinct",
    "google-tpu",
    "aws-trainium",
    "microsoft-maia",
    "inference-asics"
  ],
  "chokepoint_notes": "",
  "sources": [],
  "meta": {
    "status": "draft",
    "drafted_by": null,
    "verified_by": null,
    "approved_by": null,
    "approved_on": null,
    "last_refreshed": null
  }
}
