{
  "id": "euv-lithography",
  "tier": "T1",
  "name": "EUV lithography scanners",
  "summary": "The machines that print the smallest features on every leading-edge chip. ASML is the only company that makes them.",
  "what_it_does": "An EUV (extreme ultraviolet) scanner shines very short-wavelength light through a patterned mask onto a silicon wafer, printing the tiniest features of a chip. Shorter light means smaller features, and smaller features mean faster, more efficient chips.\n\nEvery leading-edge logic chip and the newest memory depend on EUV. One company, ASML in the Netherlands, builds these machines, using parts from a deep network of specialist suppliers.",
  "makers": [
    {
      "company": "ASML",
      "country": "NL",
      "hq_city": null,
      "fab_locations": [],
      "market_share": {
        "value": null,
        "unit": "share",
        "source": null,
        "confidence": null,
        "verified": null
      }
    }
  ],
  "concentration": {
    "label": null,
    "hhi": {
      "value": null,
      "unit": "index",
      "source": null,
      "confidence": null,
      "verified": null
    },
    "note": ""
  },
  "cost": {
    "unit": "per scanner",
    "price_band": {
      "low": null,
      "high": null,
      "currency": "USD",
      "source": null,
      "confidence": null,
      "verified": null
    },
    "note": ""
  },
  "lead_time": {
    "value": null,
    "unit": "months",
    "source": null,
    "confidence": null,
    "verified": null
  },
  "inputs": [],
  "customers": [
    "leading-edge-fab",
    "samsung-foundry",
    "intel-foundry",
    "hbm"
  ],
  "chokepoint_notes": "",
  "sources": [],
  "meta": {
    "status": "draft",
    "drafted_by": null,
    "verified_by": null,
    "approved_by": null,
    "approved_on": null,
    "last_refreshed": null
  }
}
